{
  "adversarial_variant": "ambiguous-helpers",
  "case_id": "aurora-de06ea3f96407e4cea",
  "evidence_contract_v2": {
    "contract_path": "phase27/contracts/evidence-contract-v2.json",
    "contract_sha256": "1181e027efb0e731eec9d038e96457103ee0e30113f46ba1e8588dada33fdf95",
    "contract_version": "2.0.0",
    "control_proof": {
      "barrier": {
        "effect": "authorizes-operation",
        "end_column": 51,
        "end_line": 23,
        "file": "entry.tsx",
        "role": "barrier",
        "start_column": 27,
        "start_line": 23
      },
      "sink": {
        "effect": "preserves-influence",
        "end_column": 24,
        "end_line": 25,
        "file": "entry.tsx",
        "role": "sink",
        "sink_kind": "protected-record-mutation",
        "source_kind": null,
        "start_column": 9,
        "start_line": 25
      },
      "status": "effective-barrier-dominates-sink"
    },
    "expected_finding": null,
    "expected_outcome": "control",
    "taxonomy": {
      "category_id": "secure-bench.category.authorization-dominance",
      "invariant_id": "secure-bench.invariant.authorization-before-sensitive-operation",
      "primary_cwe": "CWE-862",
      "version": "1.0.0"
    }
  },
  "exact_fingerprint": "41e86691dda075a2bb13d80e6444653919c1eaefca046d9dfd159e920c1bfa8d",
  "family_id": "SE1007",
  "fixture_ticket": "ticket-624962f3d760aa96",
  "framework": "express",
  "label": "control",
  "normalized_fingerprint": "efc77a8c5deb5bd1b1197dfa72e57433b98f7c83506505c96049ddee7a3b6151",
  "orientation": "control-first",
  "pair_id": "orbit-se1007-9b0f73fff303d6",
  "schema_version": "secure-bench-phase27-case-v2",
  "source_files": [
    {
      "bytes": 1185,
      "path": "entry.tsx",
      "sha256": "3b8b50130f4bdbe73ec1ddc2350f56ab6fb2b0d2246220531f1e06358ff13d30"
    }
  ],
  "source_format": "tsx",
  "topology": "helper-mediated"
}
