{
  "adversarial_variant": "blocklists",
  "case_id": "aurora-d92f3ee5f56ae4421e",
  "evidence_contract_v2": {
    "contract_path": "phase27/contracts/evidence-contract-v2.json",
    "contract_sha256": "1181e027efb0e731eec9d038e96457103ee0e30113f46ba1e8588dada33fdf95",
    "contract_version": "2.0.0",
    "control_proof": null,
    "expected_finding": {
      "connected_edges": [
        true
      ],
      "effective_barriers": [],
      "path": [
        {
          "effect": "preserves-influence",
          "end_column": 21,
          "end_line": 8,
          "file": "entry.jsx",
          "role": "source",
          "sink_kind": null,
          "source_kind": "http-query-value",
          "start_column": 3,
          "start_line": 8
        },
        {
          "effect": "preserves-influence",
          "end_column": 28,
          "end_line": 2,
          "file": "policy.jsx",
          "role": "sink",
          "sink_kind": "redirect-response",
          "source_kind": null,
          "start_column": 10,
          "start_line": 2
        }
      ],
      "uncertain": false,
      "unresolved_call": false
    },
    "expected_outcome": "vulnerable",
    "taxonomy": {
      "category_id": "secure-bench.category.redirect-boundary",
      "invariant_id": "secure-bench.invariant.redirect-destination-policy",
      "primary_cwe": "CWE-601",
      "version": "1.0.0"
    }
  },
  "exact_fingerprint": "37cc49760a2798b8786126854721bb54b114979928933328d5fcfbe599dfa384",
  "family_id": "SE1005",
  "fixture_ticket": "ticket-02ac2183a5164a1f",
  "framework": "express",
  "label": "vulnerable",
  "normalized_fingerprint": "2fd527e9bdb411d77e06cc1a77836a9e400bc83653b40241071074fa5155cd46",
  "orientation": "control-first",
  "pair_id": "orbit-se1005-71e401578fd601",
  "schema_version": "secure-bench-phase27-case-v2",
  "source_files": [
    {
      "bytes": 598,
      "path": "entry.jsx",
      "sha256": "654eddb1628521a33a1152261886303b08d00d4c385705c8a063102ca6a45c76"
    },
    {
      "bytes": 98,
      "path": "policy.jsx",
      "sha256": "b543de105f612d9aa2d73a0a8fbafe572f3a9100e01ccd8d1d9bc09f7076d4c4"
    }
  ],
  "source_format": "jsx",
  "topology": "inter-file-aliased"
}
