{
  "adversarial_variant": "wrappers",
  "case_id": "aurora-e21a86acee260b4eef",
  "evidence_contract_v2": {
    "contract_path": "phase27/contracts/evidence-contract-v2.json",
    "contract_sha256": "1181e027efb0e731eec9d038e96457103ee0e30113f46ba1e8588dada33fdf95",
    "contract_version": "2.0.0",
    "control_proof": {
      "barrier": {
        "effect": "constrains-to-policy",
        "end_column": 34,
        "end_line": 12,
        "file": "entry.tsx",
        "role": "barrier",
        "start_column": 23,
        "start_line": 12
      },
      "sink": {
        "effect": "preserves-influence",
        "end_column": 34,
        "end_line": 12,
        "file": "entry.tsx",
        "role": "sink",
        "sink_kind": "dynamic-code-evaluation",
        "source_kind": null,
        "start_column": 23,
        "start_line": 12
      },
      "status": "effective-barrier-dominates-sink"
    },
    "expected_finding": null,
    "expected_outcome": "control",
    "taxonomy": {
      "category_id": "secure-bench.category.dynamic-code-execution",
      "invariant_id": "secure-bench.invariant.dynamic-code-control-data-separation",
      "primary_cwe": "CWE-95",
      "version": "1.0.0"
    }
  },
  "exact_fingerprint": "0e175141cc7a1eb10762503e85bb95ec939d052ebdbb8650580c5c25d1836313",
  "family_id": "SE1006",
  "fixture_ticket": "ticket-d2e10a6aeac37af7",
  "framework": "next-app-router",
  "label": "control",
  "normalized_fingerprint": "7033507fffb22846c83e3708bb29b98084838300c942677d1e76fb131fa58521",
  "orientation": "control-first",
  "pair_id": "orbit-se1006-e6fd3f4aacc22a",
  "schema_version": "secure-bench-phase27-case-v2",
  "source_files": [
    {
      "bytes": 624,
      "path": "entry.tsx",
      "sha256": "8888e7ad3ab300ea06159c402df3262f4c045675cb3033513ee0fbe0e475a593"
    }
  ],
  "source_format": "tsx",
  "topology": "direct"
}
