{
  "adversarial_variant": "blocklists",
  "case_id": "aurora-6092efcb359ee32ee3",
  "evidence_contract_v2": {
    "contract_path": "phase27/contracts/evidence-contract-v2.json",
    "contract_sha256": "1181e027efb0e731eec9d038e96457103ee0e30113f46ba1e8588dada33fdf95",
    "contract_version": "2.0.0",
    "control_proof": null,
    "expected_finding": {
      "connected_edges": [
        true
      ],
      "effective_barriers": [],
      "path": [
        {
          "effect": "preserves-influence",
          "end_column": 21,
          "end_line": 8,
          "file": "entry.tsx",
          "role": "source",
          "sink_kind": null,
          "source_kind": "form-data-value",
          "start_column": 3,
          "start_line": 8
        },
        {
          "effect": "preserves-influence",
          "end_column": 16,
          "end_line": 12,
          "file": "entry.tsx",
          "role": "sink",
          "sink_kind": "os-command-execution",
          "source_kind": null,
          "start_column": 3,
          "start_line": 12
        }
      ],
      "uncertain": false,
      "unresolved_call": false
    },
    "expected_outcome": "vulnerable",
    "taxonomy": {
      "category_id": "secure-bench.category.command-execution",
      "invariant_id": "secure-bench.invariant.command-control-data-separation",
      "primary_cwe": "CWE-78",
      "version": "1.0.0"
    }
  },
  "exact_fingerprint": "8321d446f0ef26b675240d5ed5d9fc302b3baecc5d123c9aec29b103f0f1db26",
  "family_id": "SE1001",
  "fixture_ticket": "ticket-9dac02d016938612",
  "framework": "server-actions",
  "label": "vulnerable",
  "normalized_fingerprint": "03f6e23d410b984d6e019a9b94cb5a5797a9c37c1006ecc5d308ff6c269ff837",
  "orientation": "control-first",
  "pair_id": "orbit-se1001-a670cbf4e603c6",
  "schema_version": "secure-bench-phase27-case-v2",
  "source_files": [
    {
      "bytes": 593,
      "path": "entry.tsx",
      "sha256": "bd199fdc7a5adbb39f3a920adbfec1f04823a5aa7d7646a32750dcf75cc865d2"
    }
  ],
  "source_format": "tsx",
  "topology": "direct"
}
